{
  "id": "bulk-pgp-detach-sign-files",
  "title": "Create detached PGP signatures for all files in a directory",
  "language": "bash",
  "category": "cryptography",
  "command": "bash -c 'dir=$1; shift; for f in \"$dir\"/*; do [ -f \"$f\" ] && gpg --detach-sign \"$f\"; done' _",
  "description": "Iterates over every file in a given directory and creates a detached PGP signature (.sig) for each one using GnuPG.",
  "explanation": "This oneliner uses a bash -c subshell to accept the target directory as a trailing argument. The variable dir receives $1 (the directory path), then shift removes it so remaining arguments are available via $@. A for loop iterates over all entries matching \"$dir\"/*, and [ -f \"$f\" ] ensures only regular files are processed (skipping subdirectories, symlinks, etc.). For each file, gpg --detach-sign creates a separate .sig file containing the PGP signature. The _ placeholder serves as $0 inside the subshell, ensuring $1 maps to the first real argument.",
  "tags": [
    "gpg",
    "pgp",
    "cryptography",
    "signature",
    "detach-sign",
    "bulk",
    "verification"
  ],
  "author": "Marcos de Carvalho",
  "created_at": "2026-04-28",
  "updated_at": "2026-04-28",
  "safety": "caution",
  "shell": "bash",
  "platforms": [
    "linux",
    "gnu-linux",
    "freebsd",
    "openbsd",
    "netbsd"
  ],
  "dependencies": [
    "gnupg"
  ],
  "arguments": [
    {
      "name": "DIR",
      "description": "Path to the directory whose files will be signed.",
      "required": false,
      "default": "."
    }
  ],
  "examples": [
    {
      "command": "bash -c 'dir=$1; shift; for f in \"$dir\"/*; do [ -f \"$f\" ] && gpg --detach-sign \"$f\"; done' _ /path/to/releases",
      "description": "Sign all files in /path/to/releases"
    },
    {
      "command": "bash -c 'dir=$1; shift; for f in \"$dir\"/*; do [ -f \"$f\" ] && gpg --detach-sign \"$f\"; done' _ .",
      "description": "Sign all files in the current directory"
    },
    {
      "command": "alias bsign=\"bash -c 'dir=\\$1; shift; for f in \\\"\\$dir\\\"/*; do [ -f \\\"\\$f\\\" ] && gpg --detach-sign \\\"\\$f\\\"; done' _\"",
      "description": "Create an alias named 'bsign' for easy bulk signing"
    },
    {
      "command": "bsign /path/to/releases",
      "description": "Use the alias to sign all files in a directory"
    }
  ],
  "output": "file1.tar.gz.sig\nfile2.iso.sig\nfile3.deb.sig",
  "notes": [
    "Each original file gets a corresponding .sig file in the same directory",
    "GPG will prompt for passphrase if the private key is passphrase-protected",
    "Uses the default signing key; set GPGKEY env var or use --default-key to specify another",
    "The [ -f \"$f\" ] check skips subdirectories and non-regular files",
    "Hidden files (dotfiles) are not matched by the glob *; use .* as well if needed",
    "For large numbers of files, consider using gpg --batch --yes to skip confirmation prompts"
  ],
  "warnings": [
    "Existing .sig files will be silently overwritten without confirmation",
    "Ensure you have sufficient disk space for the signature files",
    "If GPG cannot access your private key, the loop will fail for every file",
    "Signatures are created in the same directory as the source files"
  ],
  "see_also": [
    "find-large-files-recursive"
  ],
  "status": "reviewed"
}
