{
  "id": "list-all-aliases",
  "title": "List all shell aliases in a colored, formatted display",
  "language": "bash",
  "category": "shell-utilities",
  "command": "bash -c 'shell_conf=${1:-~/.bashrc}; [ -f \"$shell_conf\" ] || { echo \"Configuration file not found: $shell_conf\"; exit 1; }; grep -E \"^[[:space:]]*alias[[:space:]]\" \"$shell_conf\" | sed -E \"s/^[[:space:]]*alias[[:space:]]*//\" | sort -f | while IFS= read -r line; do alias_name=$(printf \"%s\\n\" \"$line\" | cut -d\"=\" -f1); alias_cmd=$(printf \"%s\\n\" \"$line\" | cut -d\"=\" -f2- | sed -E \"s/^[[:space:]]*([\\\"'])(.*)\\\\1[[:space:]]*$/\\\\2/\"); printf \"\\033[1;34m%-20s\\033[0m -> \\033[1;32m%s\\033[0m\\n\" \"$alias_name\" \"$alias_cmd\"; done' _",
  "description": "Lists all aliases defined in the user's shell configuration file in alphabetical order with colored, formatted output. Works with bash, zsh, and other shells on Linux and BSD systems.",
  "explanation": "This command reads the user's shell configuration file from the path passed as the first argument (defaulting to ~/.bashrc), extracts every alias definition, sorts them alphabetically by alias name, and prints the alias name in blue and the command in green. It uses POSIX-friendly character classes like [[:space:]] instead of non-portable regex shortcuts, and it strips wrapping quotes from the alias value before displaying it.",
  "tags": [
    "shell",
    "alias",
    "utilities",
    "configuration",
    "listing"
  ],
  "author": "marcos",
  "created_at": "2026-04-25",
  "updated_at": "2026-04-25",
  "safety": "safe",
  "shell": "bash",
  "platforms": [
    "linux",
    "gnu-linux",
    "freebsd",
    "openbsd",
    "netbsd"
  ],
  "dependencies": [
    "bash",
    "coreutils",
    "grep",
    "sed",
    "sort",
    "cut"
  ],
  "arguments": [
    {
      "name": "CONFIG_FILE",
      "description": "Path to shell configuration file (optional, defaults to ~/.bashrc)",
      "required": false,
      "default": "~/.bashrc"
    }
  ],
  "examples": [
    {
      "command": "bash -c 'shell_conf=${1:-~/.bashrc}; [ -f \"$shell_conf\" ] || { echo \"Configuration file not found: $shell_conf\"; exit 1; }; grep -E \"^[[:space:]]*alias[[:space:]]\" \"$shell_conf\" | sed -E \"s/^[[:space:]]*alias[[:space:]]*//\" | sort -f | while IFS= read -r line; do alias_name=$(printf \"%s\\n\" \"$line\" | cut -d\"=\" -f1); alias_cmd=$(printf \"%s\\n\" \"$line\" | cut -d\"=\" -f2- | sed -E \"s/^[[:space:]]*([\\\"'])(.*)\\\\1[[:space:]]*$/\\\\2/\"); printf \"\\033[1;34m%-20s\\033[0m -> \\033[1;32m%s\\033[0m\\n\" \"$alias_name\" \"$alias_cmd\"; done' _",
      "description": "List all aliases from the default shell configuration file in alphabetical order"
    },
    {
      "command": "bash -c 'shell_conf=${1:-~/.bashrc}; [ -f \"$shell_conf\" ] || { echo \"Configuration file not found: $shell_conf\"; exit 1; }; grep -E \"^[[:space:]]*alias[[:space:]]\" \"$shell_conf\" | sed -E \"s/^[[:space:]]*alias[[:space:]]*//\" | sort -f | while IFS= read -r line; do alias_name=$(printf \"%s\\n\" \"$line\" | cut -d\"=\" -f1); alias_cmd=$(printf \"%s\\n\" \"$line\" | cut -d\"=\" -f2- | sed -E \"s/^[[:space:]]*([\\\"'])(.*)\\\\1[[:space:]]*$/\\\\2/\"); printf \"\\033[1;34m%-20s\\033[0m -> \\033[1;32m%s\\033[0m\\n\" \"$alias_name\" \"$alias_cmd\"; done' _ ~/.zshrc",
      "description": "List all aliases from a zsh configuration file in alphabetical order"
    },
    {
      "command": "alias list-aliases='bash -c '\"'\"'shell_conf=${1:-~/.bashrc}; [ -f \"$shell_conf\" ] || { echo \"Configuration file not found: $shell_conf\"; exit 1; }; grep -E \"^[[:space:]]*alias[[:space:]]\" \"$shell_conf\" | sed -E \"s/^[[:space:]]*alias[[:space:]]*//\" | sort -f | while IFS= read -r line; do alias_name=$(printf \"%s\\n\" \"$line\" | cut -d\"=\" -f1); alias_cmd=$(printf \"%s\\n\" \"$line\" | cut -d\"=\" -f2- | sed -E \"s/^[[:space:]]*([\\\"'])(.*)\\\\1[[:space:]]*$/\\\\2/\"); printf \"\\033[1;34m%-20s\\033[0m -> \\033[1;32m%s\\033[0m\\n\" \"$alias_name\" \"$alias_cmd\"; done'\"'\"' _'",
      "description": "Create a permanent alias for listing all aliases in alphabetical order"
    }
  ],
  "output": "\u001b[1;34mdocker-rm-stopped   \u001b[0m -> \u001b[1;32mdocker rm $(docker ps -aq --filter status=exited)\u001b[0m\n\u001b[1;34mgs                  \u001b[0m -> \u001b[1;32mgit status\u001b[0m\n\u001b[1;34mll                  \u001b[0m -> \u001b[1;32mls -la\u001b[0m\n\u001b[1;34mup                  \u001b[0m -> \u001b[1;32muptime\u001b[0m",
  "notes": [
    "The command works with bash, zsh, and other shells by specifying the appropriate configuration file",
    "Color codes: alias names are displayed in blue, commands in green",
    "Supports both single and double quoted alias definitions",
    "Alias names are listed in alphabetical order",
    "Can be used directly or converted to a permanent alias",
    "Works on Linux and BSD systems"
  ],
  "warnings": [
    "Only shows aliases defined in the specified configuration file",
    "Does not display aliases defined in sessions or other files",
    "May not work with non-standard alias definitions"
  ],
  "see_also": [
    "replace-string-in-files"
  ],
  "status": "reviewed"
}
