{
  "id": "find-large-files-recursive",
  "title": "Find files larger than 100 MB recursively",
  "language": "find",
  "category": "filesystem",
  "command": "find . -type f -size +100M",
  "description": "Recursively finds all regular files larger than 100 MB under the current directory.",
  "explanation": "The command traverses directories recursively, filters regular files using -type f, and selects files larger than 100 MB using -size +100M.",
  "tags": [
    "find",
    "filesystem",
    "disk-usage",
    "large-files"
  ],
  "author": "Tiririca da Silva",
  "created_at": "2026-04-21",
  "updated_at": "2026-04-21",
  "safety": "safe",
  "shell": "posix",
  "platforms": [
    "linux",
    "gnu-linux",
    "freebsd",
    "openbsd",
    "netbsd"
  ],
  "dependencies": [
    "findutils"
  ],
  "arguments": [
    {
      "name": "PATH",
      "description": "Starting directory for the recursive search.",
      "required": false,
      "default": "."
    },
    {
      "name": "SIZE",
      "description": "Minimum file size threshold.",
      "required": false,
      "default": "100M"
    }
  ],
  "examples": [
    {
      "command": "find . -type f -size +100M",
      "description": "Find large files in current directory"
    },
    {
      "command": "find /var/log -type f -size +500M",
      "description": "Find large log files"
    }
  ],
  "output": "./dataset/archive.tar.gz\n./videos/raw.mkv",
  "notes": [
    "Size units depend on system implementation",
    "Use -exec ls -lh {} \\; for readable sizes"
  ],
  "warnings": [
    "May be slow on large directory trees"
  ],
  "see_also": [
    "du-sort-largest-directories",
    "find-old-files-by-mtime"
  ],
  "status": "reviewed"
}