{
  "id": "init-repo-with-gitignore",
  "title": "Initialize git repository, stage all files and create empty .gitignore",
  "language": "git",
  "category": "version-control",
  "command": "git init && git add . && touch .gitignore",
  "description": "Initializes a new git repository in current directory, stages all existing files, and creates an empty .gitignore file.",
  "explanation": "This command sequence creates a new git repository (git init), adds all files in the current directory to the staging area (git add .), and creates an empty .gitignore file (touch .gitignore) for future ignore patterns.",
  "tags": [
    "git",
    "version-control",
    "repository",
    "init",
    "gitignore"
  ],
  "author": "Marcos de Carvalho",
  "created_at": "2026-04-25",
  "updated_at": "2026-04-25",
  "safety": "safe",
  "shell": "posix",
  "platforms": [
    "linux",
    "gnu-linux",
    "freebsd",
    "openbsd",
    "netbsd"
  ],
  "dependencies": [
    "git"
  ],
  "arguments": [
    {
      "name": "DIRECTORY",
      "description": "Directory where to initialize repository",
      "required": false,
      "default": "."
    }
  ],
  "examples": [
    {
      "command": "git init && git add . && touch .gitignore",
      "description": "Initialize repository in current directory"
    },
    {
      "command": "cd /path/to/project && git init && git add . && touch .gitignore",
      "description": "Initialize repository in specific directory"
    }
  ],
  "output": "Initialized empty Git repository in /home/user/project/.git/",
  "notes": [
    "The .gitignore file is empty after creation; you should add patterns to ignore unnecessary files",
    "If .gitignore already exists, touch command updates its timestamp",
    "Use git status to verify files are staged"
  ],
  "warnings": [
    "git add . stages all files including potentially sensitive data",
    "Review staged files before committing"
  ],
  "see_also": [
    "git-commit-initial",
    "git-ignore-patterns"
  ],
  "status": "reviewed"
}