{
  "id": "user-activity-and-quota-report",
  "title": "Comprehensive user system report with disk quota, usage, and activity",
  "language": "bash",
  "category": "system-administration",
  "command": "sudo bash -c \"printf 'USER\\tQUOTA\\tHOME\\tDISK_USAGE\\tCREATED\\tFILES\\tLAST_LOGIN\\tLAST_CMD\\n'; getent passwd | awk -F: '\\$3 >= 1000 { if (\\$1 ~ /^nobody$/) next; print \\$1,\\$6 }' | while read u h; do q=\\$(quota -u \\\"\\$u\\\" 2>/dev/null | tail -1 | awk '{print \\$2}'); [ -z \\\"\\$q\\\" ] && q=none; d=\\$(du -sh \\\"\\$h\\\" 2>/dev/null | cut -f1); c=\\$(stat -c %y \\\"\\$h\\\" 2>/dev/null | cut -d' ' -f1 || echo N/A); f=\\$(find \\\"\\$h\\\" -type f 2>/dev/null | wc -l); l=\\$(lastlog -u \\\"\\$u\\\" 2>/dev/null | tail -1 | awk '{print \\$5,\\$6,\\$7}'); [ -z \\\"\\$l\\\" ] && l=Never; cmd=\\$(tail -1 \\\"\\$h\\\"/.bash_history 2>/dev/null | head -c 30); [ -z \\\"\\$cmd\\\" ] && cmd=N/A; printf '%s\\t%s\\t%s\\t%s\\t%s\\t%s\\t%s\\t%s\\n' \\\"\\$u\\\" \\\"\\$q\\\" \\\"\\$h\\\" \\\"\\$d\\\" \\\"\\$c\\\" \\\"\\$f\\\" \\\"\\$l\\\" \\\"\\$cmd\\\"; done\" | column -t -s $'\\t'",
  "description": "Generates a comprehensive system audit report for all human users (requires sudo) showing username, disk quota limit, home directory path, actual disk usage, account creation date, file count, last login timestamp, and last executed command. All information is formatted in a readable table with elevated privileges for complete data access.",
  "explanation": "The command uses 'sudo bash -c' to execute the entire script with elevated privileges, ensuring access to all user data. It retrieves users with UID >= 1000 via getent, then for each user gathers: disk quota from 'quota -u', home disk usage from 'du -sh', account creation date via 'stat', file count using 'find', last login from 'lslogins', and last command from .bash_history. The 'bash -c' wrapper allows proper variable expansion and quoting within the sudo context. Output is joined by tabs and formatted by 'column -t' for readability, avoiding issues with spaces in values.",
  "tags": [
    "user-management",
    "disk-usage",
    "system-administration",
    "activity",
    "report",
    "quota",
    "audit",
    "users"
  ],
  "author": "Marcos de Carvalho",
  "created_at": "2026-04-21",
  "updated_at": "2026-04-21",
  "safety": "caution",
  "shell": "bash",
  "platforms": [
    "linux",
    "gnu-linux"
  ],
  "dependencies": [
    "coreutils",
    "util-linux",
    "shadow-utils",
    "findutils"
  ],
  "arguments": [
    {
      "name": "UID_THRESHOLD",
      "description": "Minimum UID to consider a user (default: 1000 for human users only)",
      "required": false,
      "default": "1000"
    }
  ],
  "examples": [
    {
      "command": "sudo bash -c \"printf 'USER\\tQUOTA\\tHOME\\tDISK_USAGE\\tCREATED\\tFILES\\tLAST_LOGIN\\tLAST_CMD\\n'; getent passwd | awk -F: '\\$3 >= 1000 { if (\\$1 ~ /^nobody$/) next; print \\$1,\\$6 }' | while read u h; do q=\\$(quota -u \\\"\\$u\\\" 2>/dev/null | tail -1 | awk '{print \\$2}'); [ -z \\\"\\$q\\\" ] && q=none; d=\\$(du -sh \\\"\\$h\\\" 2>/dev/null | cut -f1); c=\\$(stat -c %y \\\"\\$h\\\" 2>/dev/null | cut -d' ' -f1 || echo N/A); f=\\$(find \\\"\\$h\\\" -type f 2>/dev/null | wc -l); l=\\$(lastlog -u \\\"\\$u\\\" 2>/dev/null | tail -1 | awk '{print \\$5,\\$6,\\$7}'); [ -z \\\"\\$l\\\" ] && l=Never; cmd=\\$(tail -1 \\\"\\$h\\\"/.bash_history 2>/dev/null | head -c 30); [ -z \\\"\\$cmd\\\" ] && cmd=N/A; printf '%s\\t%s\\t%s\\t%s\\t%s\\t%s\\t%s\\t%s\\n' \\\"\\$u\\\" \\\"\\$q\\\" \\\"\\$h\\\" \\\"\\$d\\\" \\\"\\$c\\\" \\\"\\$f\\\" \\\"\\$l\\\" \\\"\\$cmd\\\"; done\" | column -t -s $'\\t'",
      "description": "Generate complete report for all human users with all metrics (requires sudo)"
    },
    {
      "command": "sudo bash -c \"printf 'USER\\tQUOTA\\tDISK_USAGE\\tCREATED\\tFILES\\tLAST_LOGIN\\n'; getent passwd | awk -F: '\\$3 >= 1000 { if (\\$1 ~ /^nobody$/) next; print \\$1,\\$6 }' | while read u h; do q=\\$(quota -u \\\"\\$u\\\" 2>/dev/null | tail -1 | awk '{print \\$2}'); [ -z \\\"\\$q\\\" ] && q=none; d=\\$(du -sh \\\"\\$h\\\" 2>/dev/null | cut -f1); c=\\$(stat -c %y \\\"\\$h\\\" 2>/dev/null | cut -d' ' -f1 || echo N/A); f=\\$(find \\\"\\$h\\\" -type f 2>/dev/null | wc -l); l=\\$(lastlog -u \\\"\\$u\\\" 2>/dev/null | tail -1 | awk '{print \\$5,\\$6,\\$7}'); [ -z \\\"\\$l\\\" ] && l=Never; printf '%s\\t%s\\t%s\\t%s\\t%s\\t%s\\n' \\\"\\$u\\\" \\\"\\$q\\\" \\\"\\$d\\\" \\\"\\$c\\\" \\\"\\$f\\\" \\\"\\$l\\\"; done | sort -t $'\\t' -k3 -hr\" | column -t -s $'\\t'",
      "description": "Sort by disk usage descending, exclude home path and last command"
    },
    {
      "command": "sudo bash -c \"printf 'USER\\tQUOTA\\tDISK_USAGE\\tFILES\\n'; getent passwd | awk -F: '\\$3 >= 1000 { if (\\$1 ~ /^nobody$/) next; print \\$1,\\$6 }' | while read u h; do q=\\$(quota -u \\\"\\$u\\\" 2>/dev/null | tail -1 | awk '{print \\$2}'); [ -z \\\"\\$q\\\" ] && q=none; d=\\$(du -sh \\\"\\$h\\\" 2>/dev/null | cut -f1); f=\\$(find \\\"\\$h\\\" -type f 2>/dev/null | wc -l); printf '%s\\t%s\\t%s\\t%s\\n' \\\"\\$u\\\" \\\"\\$q\\\" \\\"\\$d\\\" \\\"\\$f\\\"; done\" | column -t -s $'\\t'",
      "description": "Simplified report showing only quota, disk usage, and file count"
    }
  ],
  "output": "USER        QUOTA HOME            DISK_USAGE CREATED    FILES LAST_LOGIN      LAST_CMD\nmarcos      5G    /home/marcos    290G       2024-01-15 124356   May  20 13:45     grep -r pattern .\nlibvirt     none  /var/lib/libvirt 16K       2023-06-01 3245    Never              N/A\ntest-user   2G    /home/test-user 1.2G      2025-03-10 45678    May  10 09:30      ls -lah\nadmin       10G   /home/admin     3.5G      2024-11-22 89234    May  15 11:22      sudo systemctl status",
  "notes": [
    "This command is designed to run with sudo for complete information; running without sudo will show incomplete results",
    "The 'sudo bash -c' wrapper preserves the entire command context and allows proper variable expansion",
    "Disk quota requires quota system to be enabled on the filesystem; shows 'none' if unavailable",
    "File count calculation uses 'find' which can be slow on directories with millions of files",
    "Account creation date uses home directory birth time (%w) if available, falling back to modification time (%y)",
    "Last command is truncated to 30 characters; extracted from .bash_history. Note: Bash only flushes history to disk upon session exit or when 'history -a' is run, so this shows the last saved command, not necessarily the active session's most recent command.",
    "Users with UIDs < 1000 are system accounts and are excluded by default",
    "The command uses getent instead of /etc/passwd for better compatibility with different user databases (LDAP, NIS, etc.)"
  ],
  "warnings": [
    "Requires sudo access to function properly; user must have sudo privileges without password prompt configured in sudoers for unattended execution",
    "Large file counts or extensive directory trees will cause significant performance degradation",
    "Running with find on large home directories can consume considerable IO and CPU resources",
    "The lslogins command retrieves last login information depending on wtmp/btmp logs; accuracy varies by distribution logging policies",
    "Last command information depends on .bash_history being available and enabled; other shells use different history files",
    "Network-mounted home directories (NFS, SMB) will significantly increase command execution time",
    "On systems with many users, overall execution time can be substantial; consider running during off-peak hours"
  ],
  "see_also": [
    "find-largest-storage-users",
    "du-sort-largest-directories",
    "disk-space-usage-per-directory",
    "find-large-files-recursive"
  ],
  "status": "reviewed"
}
