{
  "id": "vacuum-verbose-analyze",
  "title": "Perform PostgreSQL VACUUM with VERBOSE and ANALYZE options",
  "language": "postgresql",
  "category": "database",
  "command": "PGPASSWORD=\"$2\" psql -U \"$1\" -d \"$3\" -h \"$4\" -c \"VACUUM (VERBOSE, ANALYZE);\"",
  "description": "Executes PostgreSQL VACUUM operation with VERBOSE output and ANALYZE for statistics update, following best practices for database maintenance. Accepts arguments: username password database host.",
  "explanation": "The command connects to PostgreSQL via psql and runs VACUUM with VERBOSE (detailed output) and ANALYZE (update statistics). VACUUM reclaims storage occupied by dead tuples, while ANALYZE updates planner statistics. This combination is recommended for routine maintenance. Arguments: $1=username, $2=password (sets PGPASSWORD), $3=database, $4=host.",
  "tags": [
    "postgresql",
    "database",
    "maintenance",
    "vacuum",
    "optimization"
  ],
  "author": "marcos",
  "created_at": "2026-04-25",
  "updated_at": "2026-04-25",
  "safety": "caution",
  "shell": "bash",
  "platforms": [
    "linux",
    "gnu-linux",
    "freebsd",
    "openbsd",
    "netbsd"
  ],
  "dependencies": [
    "postgresql-client"
  ],
  "arguments": [
    {
      "name": "USERNAME",
      "description": "PostgreSQL username",
      "required": true
    },
    {
      "name": "PASSWORD",
      "description": "PostgreSQL password (sets PGPASSWORD environment variable)",
      "required": true
    },
    {
      "name": "DATABASE",
      "description": "Database name",
      "required": true
    },
    {
      "name": "HOST",
      "description": "Database host",
      "required": false,
      "default": "localhost"
    }
  ],
  "examples": [
    {
      "command": "vacuum_pg() { PGPASSWORD=\"$2\" psql -U \"$1\" -d \"$3\" -h \"$4\" -c \"VACUUM (VERBOSE, ANALYZE);\"; }",
      "description": "Define shell function for alias usage"
    },
    {
      "command": "vacuum_pg postgres secret123 mydb localhost",
      "description": "Call function with arguments: user password db host"
    },
    {
      "command": "PGPASSWORD=\"secret456\" psql -U \"appuser\" -d \"production\" -h \"db.example.com\" -c \"VACUUM (VERBOSE, ANALYZE);\"",
      "description": "Direct command with explicit values"
    }
  ],
  "output": "VACUUM\nINFO:  vacuuming \"public.some_table\"\nINFO:  \"some_table\": removed 1000 row versions in 5 pages\nINFO:  \"some_table\": found 1000 removable, 5000 nonremovable row versions\nDETAIL:  0 dead row versions cannot be removed yet.\nCPU 0.00s/0.00u sec elapsed 0.00 sec.\nINFO:  analyzing \"public.some_table\"\nINFO:  \"some_table\": scanned 3000 of 3000 pages, containing 5000 live rows and 0 dead rows\nVACUUM",
  "notes": [
    "Run during periods of low database activity",
    "VERBOSE provides detailed output for monitoring",
    "ANALYZE updates statistics for query planner",
    "Consider using .pgpass file for password management",
    "Monitor pg_stat_activity for concurrent sessions",
    "For alias usage: vacuum_pg() { PGPASSWORD=\"$2\" psql -U \"$1\" -d \"$3\" -h \"$4\" -c \"VACUUM (VERBOSE, ANALYZE);\"; }"
  ],
  "warnings": [
    "VACUUM requires ACCESS SHARE lock on tables (conflicts with DDL)",
    "Avoid running during peak hours or critical operations",
    "For aggressive cleanup, consider VACUUM FULL but it requires exclusive lock",
    "Ensure adequate maintenance_work_mem setting for performance"
  ],
  "see_also": [
    "postgresql-reindex",
    "postgresql-analyze-only"
  ],
  "status": "reviewed"
}